,Key,ride_review
142,143,Uber convenient reasonable I used often disappointed That time driver took longer route house I rated driver low Uber contacted right away modified trip charge
143,144,The first time I used Uber SF Several times fantastic NYC great still good Just took longer NYC friendly
144,145,Uber great I used India Singapore got great rates US They special deals I wish makes much competitive mass transit
145,146,Uber scam pyramid scheme They always find new ingenious ways rip drivers riders even employees I hope crash burn
146,147,Recently I took Uber Ft Lauderdale airport Miami International Airport I told cost going However I received PayPal invoice stated I charged It made upset seemed like price gauge I noticing Uber I probably better catching regular taxi Since I used Uber probably wo use
147,148,When wife died states away Sunday Thanksgiving I needed get home NJ They awful Newark Airport Some drivers came disguised UBER drivers take I NEEDED go Nor UBER drivers begin Drivers put luggage car pulled away EWR asked heard said Sorry get They never available Suburbia late night early AM
148,149,The Uber drivers used One creepy two ladies nice The one thing common SLOW They drive way speed limit I felt like I never going get destination
149,150,I used Uber world always prompt convenient well cheaper standard taxi The drivers always polite also friendly I reservations many aspects gig economy feel little guilty I use services Uber I fault service I received customer
150,151,At first issue charges I wrong nasty cust service Because I felt I ripped I said I sleep voila first thing morning correct amount adjusted bank less I thought Way go Uber I stand corrected I recommend service friends colleagues I use services AGAIN I need Plus taught patience old pushy dog Lol great job contacting guys soon Thank
151,152,I taken Uber half dozen times one pleasant experiences The unpleasant experience went beyond pale however I probably contacted Uber ride I sure arrangements made care problem customer service always stellar All told Uber lifesaver occasions I want drive
152,153,I used Uber passenger I driver I get outstanding rating comments passengers I like see drivers I get also really care passenger transporting
153,154,It first time using service I found quite convenient The app easy use I able download order car quickly The car arrived said able track location car arrived cool Paying advance also convenient since meant knew cost ride beforehand price change slow traffic anything else
154,155,For part Uber convenient fast Need way tip driver road rage much exception Still way better vetting taxis
155,156,This one old small worn Uber vehicle hour trip airport Ft Collins Denver airport But driver friendly drove safely
156,157,Used Uber Boston MA Driver excellent knew way around peak driving time work We used Uber times always got destination time
157,158,I used Uber many times time I exceedingly pleased The drivers prompt courteous professional I highly recommend Uber
158,159,Great rider get quick service Poor pay drivers due flooded market No concern given fact hire many drivers enough riders make trips worth time fuel
159,160,The experience Uber entirely dependent driver One driver took excellent care another driver almost left miles destination industrial park hotel I threatened call police
160,161,Please please use Lyft cab service Uber awful I driver verbally abuse morning I asked Uber full refund They gave credit basically said think situation warrants full refund Clearly company supports abusive drivers customers I NEVER using services
161,162,I needed Uber moving Mexico City work I created account put debit card credit card PayPal accounts Uber said cards invalid connect Paypal I checked banks make sure accepted validation amounts sent Uber Uber NEVER contacted either bank verify cards When speaking Uber refused address issue They merely told add payment method As far PayPal problems ignored going I really needed use Uber get work I bought gift card thinking definitely accepted No either They also take cash I deleted account I expect returned So far response I get pin redeem Not sure means refuse cash I never use Uber I see lousy reputation The arrogance previous CEO infects entire company Hopefully new CEO may change although I lot hope
162,163,Hi For days trying change phone number existing UBER account avail also lost days discount coupon account No access LIVE person done automated responses address inquiries Shame started well unjustified cancellation fees technological issues lack customer support much
163,164,I left phone Uber I log account Uber needs multi factor authentication meaning sending codes lost phone Because else I need log Uber account another device So I tracked phone location Politely asked phone back refused Though driver picked also happened another Uber I way contacting Uber without getting Uber account way getting Uber account without phone I guess I wait new phone comes I mean common decency serviced based product unheard Uber I mean I going wipe device useless It locked paper weight
164,165,I purchased Uber gift card thru phone app used debit card There problem email addresses changed phone numbers son get monies I paid I wait funds reappear Uber merge email accounts weeks still nothing There NO LIVE SUPPORT LINKS IN EMAILS ARE DEAD ENDS The phone third party verify app ecard purchases I left many messages call back nothing
165,166,I request pickup several times since drivers waiting midnight price surge They cancelling pickup I getting charged cancellation The next day driver said find although next driver issues I charged cancellation fee The unprofessional driver hung I giving specific directions trying make easier find I visiting LA staying Santa Monica These experiences somewhat soured trip
166,167,I spent total hours days trying install UBER phone I type phone number asks password Seems pretty simple I type password I told incorrect password I know true I try carefully still get incorrect password message I type email address associated password told correct email address I try reset password fall infinite loop give response I tried calling assistance good luck Their numbers posted I finally thought I got young lady hung I noticed large number complaints sudden gone I believe UBER refreshed site eliminate bad publicity So lost customer I signed LYFT took minutes Do need LYFT
167,168,I prepaid Uber app ensure I problems traveling On I attempted prearrange pickup following day class essential upgrade professional license I unable schedule pick received message request failed please enter new payment method I contacted UBER help assured trouble prearranged services problem following morning The following morning I received error messages also linked credit card PayPal Despite told fixed problem day rectified I ended missing day class cost additional dollars I attempting obtain refund UBER continuously failed refund account despite almost daily communication via email help application This company absolutely horrible customer service Lyft much better reliable service
168,169,I recently took Uber checking trips next day see I charged cleaning fee My driver name Michael picked Delray Beach Florida dropped Boca Raton Florida The ride cost When I asked Uber Uber help I advised I charged cleaning fee I received pictures vomit seat floor This something I absolutely I asked community manager area call I received response These pictures submitted I feel violated feel nothing I dispute charges becomes said said type thing The attorney general needs advised going Uber drivers extorting money fraudulently riders I loyal Uber rider years issue I attempted resolve issue Uber feel I erroneously charged cleaning fee something I I hope driver gets investigated terminated people
169,170,I requested UberX told arrived Will Willie I made way outside find gone I checked App see canceled find I way How I still home I emailed Uber situation Harsh asked details I responded providing screenshots hours waiting hearing nothing I told issuing refund based trip details looks like trip took place SMH WTF I even offered provide picture asked contact driver picked avail Thoroughly disgusted Uber
170,171,Unable retrieve phone left Uber car days nonstop attempts Surely I one left phone leaving party surely I one greatly depends phone No customer service
171,172,I driver I drove several times past weekend I several rides surges Customers even told ride surge Now said done Uber want pay correct pay This first time happened I tired fighting giving money owe Be warned decide driver Uber They short pays continue get scripted replies someone another country
172,173,I never knew going difficult task contact Uber customer service issue husband In fact customer service per se critical safety response line much help problem What happened husband left Uber wallet documents id cards credit cards pictures etc He really got stressed lot contacted Uber app right away able reach driver You must know really ca reach driver even though Uber app transfer call The driver never picked phone voicemail set leave message From Saturday night Monday night know anything lost wallet At least call back us found find ever read driver Syed lost hat even dollars wallet stress husband go lost documents One foreign driving license easy replace Even know may find first least simple message nice represent large developing company
173,174,I finally caved opened account UBER order take ride Hallandale Fort Lauderdale Airport fly home I impression first ride free I find place enter code Nevertheless I picked dropped charge Once gate I thought I go back app learn perhaps discover enter promo codes That I saw second charge applied To make long story short number back forth emails UBER seems driver Yuniel speak word English claimed dog I urinated seats The UBER reply fourth email included I find absolutely astounding require multiple back forth emails much stressing following reasons I flying Florida car dog Had seat like previous passenger I entered car I tried save picture try capture time stamp proof saved UBER know I charge reversed VISA wo satisfy means driver still get fake cleaning charge The driver known make ridiculous story perhaps claimed passenger ill I want give ideas something driver Yuniel thief But company reputation maintain go length support scam disheartening I year old clean cut person traveled without pet kind I taken ride pun intended company behind driver far done nothing resolve except continue send emails driver ridiculous claim Through magic snipping tool I present photo driver submitted Would sat Not I continue write UBER resolved Unfortunately company single driver eliminated future business UBER
174,175,I live San Francisco city using Uber two years About six months ago I first issue two drivers I report violations My score always stars Uber allowing drivers leave negative rating riders reported left negative feedback due unprofessional rude dangerous behavior My score dropped Yesterday afternoon I correctly honestly paid two seats spouse driver arrived car one seat available When asked cancel ride denied request multiple times stared us creepy way When heard going contact Uber immediately left us sidewalk bags kept making us pay ride benefitting two passengers back seats occupying wife seat bother move enough allow sit unpleasant behavior understood fault much driver since must paid one seat causing main problem The driver retaliation damaged profile score I stars I working hard restore score bad drivers damaged months ago seems like riders way protect similar behaviors We constantly risk finding unpleasant arrogant lazy even dangerous drivers Uber Customer Care care I able obtain refund I asked restore score I ended infinite loop excuses explanations policy prevents modify riders drivers way bad drivers allowed damage reputation good customers customers reporting issue I informed Uber I rights move legally despite claim fake policy In particular let Uber arbitration clauses prohibits customers suing company scare stop fighting rights April California court ruled obscured terms service privacy policy screen meaning rider suing company reasonably notified giving right talking privacy defamations involved similar situation aware despite Uber claims rider profile NOT private requires one person see driver public And many drivers takes advantage low score avoid picking behaving badly way If driver damage score retaliation reported given star Uber driver face lawsuit
175,176,Uber charged card ride take place I notified bank Uber charge weekend I never left home Attempting contact Uber phone submit fraudulent statement via website proved impossible The last Uber contact number recognize phone number Their website permit required screen shot fraudulent bank transaction Ultimately I resorted closing card reasoning happened certainly happen Shame Uber
176,177,First Almost impossible try find way send technical question Once I got someone totally misunderstood issue Then assigned RESOLVED tag WAS discontinued contact NEVER HAD MY ISSUE RESOLVED AND NOW THEY WONT RESPOND This company WAY TOO DIFFICULT deal Giving Just gon na stick Yellow Taxis
177,178,I recently Seattle fun trip Used Uber several times without problem But sudden charged nowhere never respond But thank God bank denied fee Then I asked ride cancelled yet said I location I requested charged cancelled ride NOT And trying contact customer service joke say least I used Lyft yet checking Uber big rip careful
178,179,Attempting schedule ride Uber using app failed times app verify card security code back three credit cards I entered app I returning home shopping frozen goods relying Uber get home After several failed attempts I noticed Uber shifted surge pricing still higher surge pricing I finally able schedule ride However I believe I drove rate I requested many rides app took hold I asked Uber investigate concern heard back original message deleted
179,180,I Uber driver I took couple riders happens husband wife When I picked riders women wife badly intoxicated sitting sidewalk It first time I know happen next I picked LA headed Torrance By time I nearly got destination wife threw car The husband helped catch puke onto shirt since liquid throw soaked back leather seat anything I completed trip home got car Since first experience rider throwing back seat I know claim clean fee I used wet towels clean threw able wipe pukes back seat The alcoholic smell gone left car horrible puke alcoholic stinks I spend nearly minutes cleaning open whole car windows smell bad My car fresh brand new less year old Lexus IS I found app I request cleanup fee via Uber So I took pictures sent pictures explanations situation happened rider I drive due alcoholic smell I home The next day Uber customer service contacted via email Here said If submit photos damage clearly show mess including wet seat explanation happened within hours happy look cleaning fee The photo submitted show mess charge rider evidence mess I apologize inconvenience Thanks much Uber After exchanging emails days Uber pay penny tried help cleanup fee car I really disgusted tired Uber customer attitude towards drivers I heard Lyft pays straight detail fee rider throws car As probably dealt experienced Uber drivers say Lyft much much better drivers riders comes satisfaction
180,181,I Uber passenger multiple times problems When problem one help I ask phone number say phone support Just email I charged double stated Uber account going different destination I went I emailed multiple times reply saying resolved That price I think No one really read complaints I kept emailing last email said sorry ride days closed I emailed several times response Uber right always wo listen customer support stinks My dollar trip stated app Final
181,182,UBER care drivers vehicles For issues people responding Philippines initially say We offshore trained use initially prepared ready texts Those guys disclose unique info like employee ID initials imitate work issue imitate care imitate responsibility Every time different person responds veil anonymity You ca talk manager Their system designed discourage drivers resolve issues confuse distance On top UBER want sued They want arbitration UBER also like class action measures How possible USA government allows american corporation play games people avoid responsibility
182,183,ON I Oregon alone trip University needing ride PDX get home CA I chose Uber Lyft driver available time arrival worked I arrive airport PDX plenty time But getting lost looking gas And use app guide pick locations I ended late therefore made miss plane I sorry This unacceptable Uber feeling helpless time I quoted My time gave ARRIVE PDX gave min catch flight I WAS minutes late I MISSED MY FLIGHT BECAUSE HE STOPPED FOR GAS AND COFFEE That unacceptable I know going driver definitely thinking make pit stops take streets airport miles away He refused take freeway first time I asked finished coffee said ok time things look good Thank I feel Uber able assure times routes ca control drivers There traffic morning reason drivers miss flight
183,184,I bought Uber card I way work pretty high amount I allowed use card first I use anymore I try go customer service good They run around circles took money account I bought credits They tell still work The Uber card scam I really want put star stars
184,185,I feel compelled let people know one seeing hidden charges show ride I recently Boston actually ran street get car early driver stop heavier traffic charged wait time charge How heck work No response Uber yet wrote The driver nice good ride destination fee pumped make money I right door address I put Uber agreed pick wait charge wait put Also couple weeks ago Albany NY charge quoted getting receipt breakdown showed toll Uber worker comp charge Hmmm toll road taken heck happened So I starting think coincidence however print itemized receipts route taken hold I decide I going report Uber sooo great started Honest nice cars great drivers billed one fee knew going include front Again neither situations happened billed respond issue tell charge Signing Lyft today Hearing great things perhaps want business I think Uber may issues people Watch receipt breakdowns
185,186,A ride exact origination destination similar traffic condition driver availability situation usually taking around charged around driver get extra charged amount UBER naming whatever price want without supporting facts customer service extremely horrible one even marked issue resolved without content reply Please caution take ride front showing price UBER app rip
186,187,I honestly lost track number times I frustrating experience company It got least point within past year Each time I attempt resolve problem contacting website option speak human The process attempting communicate every single time another giant frustration I decided stop using services many better choices thank Lyft recently enticed email I got offering unlimited rides month I decided buy pass unlock rides I arrived home see I charged ride showed app And I found yet writing another disgruntled email try remedy situation Please save trouble use different taxi service
187,188,I contacted Uber ride August PM The first show The driver notified pick But I charged fee Could contact Uber protest charge I never use Uber
188,189,I able successfully use app Whenever I tried get ride says check connection It never seems problem connection comes excessively texting messages urging become driver remembering credit card information I never requested info become driver rider When I went online contact customer service option fill generic field customer service number hands flimsiest excuse lack phone support I ever heard It message tells get back hours When I need ride going solve problem I tried hours I yet receive reply Direct quote More often phone messages incoherent slow ability provide customer support How actually answering phone use automated call back service Or chat support website Calling cab may pricier much less aggravating It I already feel though I need stiff drink
189,190,It August Dallas Texas raining hard I called Uber ride go ortho appointment I Parkland Hospital I involved horrific accident January leg nearly severed saved amputated I wheelchair months today first leave house without wheelchair walker go appointment It pouring rain driver pulled close umbrella I trying balance get vehicle got mad umbrella wet got water vinyl seats busy throwing fit I standing outside car allowed get I move umbrella dry seat Show put rude talk I told I get another driver Uber nothing matter charge cancellation knowing I fixed budget needed Rideshare money go towards another driver I hire weeks I another driver refused stop morning take appointment like neighborhood She nicer neighborhood said feel safe picking anyone neighborhood I asked bothered take trip first place I paid cancellation
190,191,I active user Uber I saw service available France recent vacation I used Uber rather taxi I left iPhone Uber last Thursday Bordeaux I immediately tried log account contact driver apparently I another country required I provide verification code sent phone Uber driver car My friend also Uber user contacted Uber app file inquiry behalf We less emails Uber customer service different person time asking file inquiry online always lead service sending verification code finally got France Uber contact driver Saturday two days phone left car phone The driver met hotel told contacted Uber fact phone minutes I left car Thursday Because privacy policy I contact contact We coordinate Uber Customer Service whatever CRM system using track passenger inquiries sucks Unbelievable company size
191,192,In Kadubeesanahalli AM front Tech Park Uber driver hit vehicle right side I stepped find I asked lot space hit car He replied saying I want go left edge road immediately I hit vehicle If I hit vehicle stop I go left edge road drop passengers This Uber drivers Uber encouraging teaching drivers hit kill people order drop passengers time We one way road He least know one way He says two way I go direction I want Very strange people earth This social responsibility Uber Great organization
192,193,Uber took another city away less minute without even leaving home Got charged trip I order took Never leave card information app check app regularly ensure victim fraud
193,194,SHAME ON UBER THEY SHOULD BE SHUT DOWN
194,195,Uber car service selective certain customers offering flat fare packages deals If customer normally spends never offered I however accidentally offered another rides package I tried accept one let I contact customer service told prove offered really horrible even go I screen shot sent They apologize said sold I receive next month Not Again friend barely catch Uber offered I mess Uber get lost They also give one price driver gets lost hike price You screen shot ride start
195,196,My uber driver stole money account dollars His name Michael License plate Be careful charge extra My ride came dollars make things take money account Uber unprofessional
196,197,I driving uber course idea uber unique company bottom line taxi company Only taxi companies drivers may non professionals uber company I ca see anything american Number one unique company enough great company bet dirty cheating company cheat customers cheat drivers automatically mean cheat government I warn every customer driver check trips mileage time compare charges surprised matching reality small big different Even small different cheating may multiply cheating quantity trips daily millions monthly billions Is American way I think driving miles paying trying prove gps much charges customer paying customer give tip reaching account charge customer paying less percent must month ca fix problems app area I continue line list check every trip let allow cheating even penny I think real American way
197,198,I waited spot airport Car minutes away I waited minutes car arrived Yet Uber charged waiting time The charge small question principle honesty Is due improper reporting driver I correct erroneous reporting If Uber making mistake I get corrected It difficult contact Uber customer issues I avid Uber rider I look options
198,199,I used Uber ride secured Uber pool price change When I receive receipt ride change I contacted Uber error insisted price receipt correct This clearly case price switching Uber want take responsibility Not mention driver got lost several times using Uber map system I use google app phone get driver pointed correct direction Uber customer service absolutely help incident
199,200,I several issues Uber especially navigation minute ride service takes minutes hour application I last straw yesterday I requested Uber three minutes away stand wait minutes Of course Uber gives two minutes cancel almost every time case extra charge almost dollar certainly scam probably adding many unknowing customers making lot money I always pay attention email receipts come They even indicated hold put account lower amount turn charging That prompted look side I shocked see lack customer service On another note almost impossible conversation customer experience Uber I tried several times past They interested knowing customers think They also force rate drivers poorly fault often times application send wrong location I done Uber
