,Key,ride_review
383,384,On Feb night I boarding Uber cab daughter booked driver started without checking I got door closed Result right foot came wheel car I shout stop I asked reverse car took good five minutes inched back bit I told reverse foot still stuck yell decided move back The pain unbearable I go hospital insurance left back daughters decided India go hospital due language barrier France comprehending English challenge I want wrong diagnosis I ended ligament tear right ankle take long heal I submitted hospital report Uber told compensate injury I wrote uber support Natasha called today asked I insurance I Paris I told instead asking claim insurance Uber actually pay compensation injury unwarranted pain caused due negligence uber driver duty I shocked responded Uber responsible anything happens customer ride I take company driver works ridiculous shame established company like Uber washing responsibility leaving affected passenger sort third party The cab booked uber saying uber responsible disgrace speaks volumes lack business ethics Uber demonstrates I wrote Travis Kalanick even tweeted post response
384,385,I recently need transportation Tampa FL assisting medical issue We flew Texas told try Uber instead regular taxi We pleased vehicles clean drivers friendly prices much better taxis I know cost airport hotel taxi cost cost returning airport hotel Uber car
385,386,We pick point Little Italy San Diego California moment ordered Uber ride Our driver never showed We request another Uber driver took us airport Uber refused incorrect cancellation fee
386,387,This first experience using Uber I called ride given price I accepted ride overall happy prompt pick driver Later month I reviewed charge card noticed I billed Uber next day additional When I emailed complained answer driver unable calculate price correctly I believe Uber charge card without consent The fact driver made mistake problem agreed cost first time using Uber Later I told I given discount new customer Uber standing behind additional charge This worst customer service I ca believe Uber thinks ok charge card ride Can imagine store charges add additional cost whatever reason wanted This right The driver eat cost learn mistake
387,388,Some drivers creepy Some passengers rude I like surges passenger cool drivers
388,389,My husband I staying Hotel Chicago We going dinner knew need cab The line cab long moving slowly Our daughter us called Uber minutes If waited long line missed dinner reservation The driver pleasant college student neat clean car We used Uber Olympics Rio last summer cheap drivers quick
389,390,Uber care I charged ride I taken many times never paid They adjusted fee next morning claimed driver let us know issue prevented trip timed properly added charges reflect After dealing new customer rep every question getting explanation I moved challenge bank Enabling fraud horrible customer service Zero stars possible
390,391,I used Uber generally good But occasion either never showed find location inconvenient I find alternate method
391,392,My first experience Uber San Diego My wife I attended event Union Station wanted ride back hotel We called taxi message vehicles area call back hour inquire We downloaded Uber app less minutes later Uber
392,393,I live Las Vegas NV experience one drivers tailgating freeway passenger car I sent messages website every form social media let know need check drivers thoroughly nitwits I getting canned responses one acknowledging issue hand Sounds like real winning company sure
393,394,I using Uber quite time normally app since I fighting phone company I ordering via internet I normally take pool cheaper obviously provide fair quotes pool I cross reference UberX first ensure surging make pool request So I like normal price I figured pool least less To surprise I paid I even took screenshot sent Uber reply except automated message Straight rip Use Lyft
394,395,I going friends decided get Uber We called Uber come pick us apartment We gave address drove us destination It long ride tried talk He rude us gave us short one word sarcastic answers When dropped us anywhere close destination walk two miles get This good Uber Experience
395,396,I used Uber last weekend first time drivers amazing I felt comfortable safe Found experience good
396,397,I one experience request Uber confirm pick never show Myself friend stood half hour pm night waiting driver called said right It dark women standing street feeling unsafe waited Then next days I deal Uber charging card cancellation They wanted satisfy credit whole inconvenience Seriously Very unreliable worried customer safety satisfaction
397,398,I called set Uber ride As I waiting I saw making wrong turns driving away I called contact number received message phone receiving calls time I texted going wrong way respond I saw sitting moving anymore I texted still respond After I cancelled ride new ride got Target parking lot cold By time new driver came got home almost I charged ride I cancelled I contacted Uber said So driver phone find still charge even though waited called texted driver respond You stuck charge I feel reprimand driver let take loss charge setting better driver
398,399,Uber one shady unethical companies ever created I stopped driving year ago decided try UberEats delivery person I figured better I drive people boy I wrong First take every delivery Then enough delivery drivers I noticed I driving mins reach restaurant compensated pick order delivered location may mins away Giving driver whopping delivery I also gone pick orders arrive restaurant find order cancelled Uber compensate driver cancellation fee The order still showed active app nobody took time notify I stopped accepting requests mins away So order cancelled I lose anything So guess Uber started manipulating travel time restaurants often times changing min away So I received request instead showing actual mins away showed min So accept request hit navigation GPS shows actual time cases restaurants mins away It work though I deliver areas I know really well I well aware restaurants close location At first I thought something wrong app Uber never responded I asked manipulating instant pay Uber offers drivers option cash daily using instant pay Sound like winner right Wrong Instant pay work time There several times I needed emergency money bills etc So I go deliver hit instant pay button guess I worked hours I ca get money I contact support means never resolved Uber give I received different reasons different support reps I get money Uber says keep driving check back week days It resolved They charged flimsy delivery bag I never asked I delivering weeks I received something mail I set aside never opened days later I checking earnings I noticed missing Contacted support see money told delivery bag I never ordered asked I told I like refund I order I open Next thing I know like You keep bag give refund A days later I noticed Uber sent email offering I give pay statements Lyft When I answer sent another email offering No thanks Uber That private information I keep lies time drivers earnings also riders really thorough background checks drivers Nor research restaurants use UberEats A lot restaurants I picked orders low health scores Most low high good They concern anyone They care bottom line If deliver make sure accept orders close proximity otherwise lose money Keep mind court ruled Uber penalize accepting orders accepting cancelling days ago I needed emergency money I turned app I started deliveries I reached goal I hit button cash never received money I contacted support literally blown They made effort help I ended borrow money mom The final straw I attended Uber q Uber employees answering questions laughing unprofessional They responding drivers like went less weeks UberEats delivery driver I delete app I sent request permanently delete account When I sent delete request I received generic response Uber asking help Well day late case short I ca support company care anyone If use service rider driver make sure pay attention money
399,400,I arrived Las Vegas called Uber driver Judylynn acted nice etc asked I wanted charge cell phone Not thinking necessary I gave charge She dropped Hotel strip I soon realized I left phone car Gone You ca get touch Uber phone She wo I going call LVMPD report stolen And get security video This Horse Manure What hell wrong people You fired
400,401,How keep getting away things I use Uber everyday multiple times day I drivers blow stop signs drive recklessly etc I needed Uber night I used app I connected Mohammed He immediately calls tell min away even though app always accurate said min away I told I wait min later since obviously took sweet time pulls halfway block I walk towards I open door driver passenger side drives He actually hit hurt I called repeatedly answer He pulls end block main road As I speed walk towards waving arms drove I saw drive drive around neighborhood park around block see app I called nothing He cancels trip I charged cancellation fee I wrote Uber driver clearly reckless emails generic one really reads anything They refund money thinking concern The emails go back forth finally get someone name Lia extremely rude said I get refund company need give one meet eye eye case closed I witness I almost hit drove company responds Someone loyal customer I use Uber multiple times day I want something done customer service rep Lia driver I backing I enough
401,402,First I want say I used Ubers months NEVER problem Wanted write happened let others know Uber great A friend always used Uber Phila I idea I recently moved Florida took trip back home Phila via Tampa airport The cost Uber airport I gave tip On way back Tampa airport I also use UBER WRONG Again NO IDEA Ubers allowed near Airport After flight got LATE evening I got online summon Uber site pull I tried I worried submitted using Taxi I walked sitting side asked available They stated yes I like go I told Treasure Island told LEAST WHAT I said Ubers charge I get online He said You wo NOT allowed So taxi rob people Taxi want Ubers rob people especially need I BUT I took taxi bridge friend pick Guess I taxi minutes charge That BS I got bridge instead calling friend I called Uber STILL got home cheaper Taxi drivers legal thieves It really needs stop
402,403,I experience stolen Uber customer despite contacting Uber using police legally expectations Uber declined give police information need prosecute thieving customer It sad Uber came Kenyan market Kenya police They made impossible get reprieve crimes committed drivers customers To get security team email nightmare They phone communication confused staff keep sending junk mail despite complaints
403,404,Be careful Uber getting sloppy overcharges providing credits charging Cancellation fees canceled This All happened within last week Uber late arrival twice last week They sent text message time stating credit next fare It ride I never keep text messages I remember sort problem I ride quite bit I think anything credits couple days messaged Uber several times They want provide dates times text message I provided dates times yet still ask I flabbergasted text messages comes credits Still working Funny want provide proof look receipt Their Customer Service regarding issue complete joke Another time Overcharged If I look receipt screwed overcharge A driver canceled ride last night Uber charged cancellation fee I still waiting response Now I review every charge
404,405,We know Uber lousy try Lyft instead another example Arriving Fort Lauderdale airport tried Uber It accepted driver called cancelled saying early They told go app cancel I assume charge get trouble cancelling ride This happened second time different driver exactly Then finally one arrived Uber charge credit card cancelled fees instead charged entire amount rides I take list site cancelled I paying close attention credit card transactions gone unnoticed There way contact Uber support either When call tell send email support Then send email address comes back address get monitored read Uber sucks
405,406,I saw commercials needed transportation I disabled knees legs also weakened I opened Uber account added promo code thought I set first trip wrong I refused pick times stranded I tried walking legs gave way fell side road stranger helped gave ride home I contacted company stated account problem fine next ride I dropped family member work called Uber I refused ride I pay pocket I granddaughter dropped home contacted uber said I must credit debit Paypal android etc form payment I explained I two reps confirmed I use gift cards I requested refund gift card Uber refused stating Either give us credit card services give refund So I sit swollen knees It bad experience I need doctor appointment
406,407,I purchased flat fare package NYC use boroughs Uber pool Uberx fare I take Uber pool clearly quoted I screenshot charged I contacted Uber customer service sucks told driver issue prevented trip timed according proper pick drop It clearly states felt driver compensated This company putting fake advertisements charging totally different fee without customer consent
407,408,Here I sent I sick fraudulent charging cancellation fees When I cancel within SECONDS ordering car warns may fee canceling MINUTES After ordering Yet regularly charge cancellation fee I asked customer service people escalate Legal department This illegal practice Then I dispute charges You gambling people wo complain wo notice I notice Today I canceled two cars within seconds ordering eta long I got charged customer service refusing refund ILLEGAL charge Disgusting I inform every legal authority I think order protect public Meanwhile I demand refund two appropriate per YOUR rules cancellations
408,409,We booked confirmed pickup Anna Maria Fl PIE Fri No show Lost flight get another Tampa Omaha cost us Did talk someone Uber said nothing Should insurance something like Never done yet
409,410,Supposedly Uber meant cashless per response unless got driver The ride Boca TOOJAY Deli Glades Rd WPB started stop gas station driver complained cost pay cash vs credit card per gallon The ride went well arrived WPB drive said I credit cards I offered card This fine I always carry cash I asked much said like like I said fine I handed driver asked back He said offered ones went house grabbed I gave I get electronic receipt iPhone showing receipt The receipt attached I tell first time Uber customer I defrauded money issue I plan individuals staff seek YOU right thing Uber Thanks letting us know Greg As reminder Uber experience meant cashless We happy review trips make necessary adjustments fares let us know issues arise We also reached driver get side story well In meantime let us know anything else help Sent MICHAEL Tuesday February AM
410,411,My Uber ride home enjoyable I paid After shopping I turned Uber app request ride Everything normal moment I pressed request ride The app moved view airport asked select location I backed tried app still insisted I select location within airport Funny thing There blue dot REAL PICK location app allowing click blue dot When I manually entered location still swung back airport I yr old choice agree ridiculous overcharging When I brought Uber attention I dismissed gave response It higher demand Uber service Yeah OK Long story I ripped Uber gives I NOT using service ever
411,412,Undisclosed charges fees This company offer support driver partners They adjust fare payments without giving driver notice close http links access driver support withhold account information I received full payment service rendered reach live person received chat response resolve
412,413,Two days ago I took trip Uber Santo Domingo Dominican Republic I normally use service every day Another passenger trip forgot phone car Since sent messages Uber Customer service They finally determined driver found phone still waiting returned Uber driver direct contact information yet way I get feedback Uber Customer Service system I think cases Uber make easier driver customer communicate directly I longer using Uber recommending services incident We want item returned I longer trust service reliability safety rating
413,414,Let start saying I disability My team office decide lunch Clyde Chinatown The driver taking Chinatown pick front building want I like keep trying invite lunch The nightmare I watching driver going around circles I tried calling answer He finally called I barely understand He wanted meet almost block away I told I disability needed pick front Clyde cancelled scheduled another ride Once I person wanted meet corner I finally took taxi back office picked front Clyde dropped front office From I need travel DC I taking taxi By way I complained Uber I got Sorry I trust vetting driver Oh way driver cancelled charged cancellation fee Uber refund email keep implying fault I want know fault drivers seem know drive DC Never
414,415,Regardless Uber says care less driver earnings interested signing new drivers Last Saturday night Ocean City Maryland coastal town runs miles long drivers That one every feet roadway That nothing total BS About every three days I get message Uber offering bonus I refer new driver make trips Hey Uber concentrating drivers making driver app work
415,416,Uber care drivers So UBER take fuel charges weeks sends letter explaining fault correct problem two pay periods take fuel charges one pay And top riders damage vehicle UBER tells pay deductible file claim They overcharge riders upfront pricing takes nearly rides miles And fair driving night subjects rated drunk racists turn deciding factors whether I able continue driving platform
416,417,I purchased Uber gift card put card I unable use every time I try book ride says accept form payment I back forth via Uber tried everything told nothing working I since pay transportation costs I use Uber credit It shows account wo process Uber able give solution attempted refund money I money give away I want back DO NOT PURCHASE AN UBER GIFT CARD IT WILL BE A WASTE OF MONEY
417,418,Used Uber probably times time arrived almost minutes late ended wrong destination They pay attention sign road showing address reliable means locating simple address Absolutely ridiculous In last times I used also added booking fee Unimpressed In speaking drivers area know going Relying solely GPS One driver even know bearings N S E That baffled end As result crappy service I cancelled account Local cabs dollars arrive time know EXACTLY going
418,419,This damn service charging rides I used I notice bank statement Uber charging rides week I notify bank pull rides past days I used I OTR truck driver cars home My next step report Uber BBB take court crap For I take cab pay extra money instead getting ripped UBER PEOPLE Stop using uber
419,420,My vehicle inspection ran Uber gave notice I went got inspected sent inspection papers Uber They emailed back said wrong form You get Uber forms fill But I respond back email find get I tried days get touch Uber form need CAN NOT get touch anyone way They reply generalized questions website
420,421,I signed Google ad directly Uber website Orange County drivers CA receive signing No conditions terms listed I took pics video I read many stories trying cheat people I inquired I signed I get bonus told OC drivers I googled ad still running OC drivers I took pics video wrote false advertising They told pay full bonus rides After rides contacted saying I get link SanFran link I already sent evidence Orange County link I weeks I written opt Arbitration letter I going pay I opting joining lawsuit This intentional scamming They running ads USD bonus new drivers OC tell get
421,422,We never used Uber know procedure friend called confirm minute trip home airport The ride cost us We know friend charged account Of course got airport driver removed luggage held hand We gave unknowingly paid advanced phone secured credit card payment He knew darn well must mistake No way anyone tips minute ride He say anything The driver kept money
422,423,I driving Uber Uber navigation application total disappointment When accept rider request address rider disappears application screen leaving mercy Uber application navigate well So time enter vehicle GPS application Then Uber application routes wrong location understand direction car actually going I used Google maps Waze applications issue The Uber application interface either well going circles quite often Uber waste time money make Uber gets big portion fees They done better job development My car GPS runs circles around Uber application problems getting specific addresses So wrong Uber application
423,424,App works fine nowApp works fine nowI driver active account This second third time I opened app forces go Bonjour leasing partner website without allowing access account I NOT ASK one overpriced per month leases I JUST want get account
424,425,I booked Uber railway station The status showed take mins reach destination The Uber driver SADIKNOOR whose car number almost right called inquired I wanted go I told destination railway station After waiting long able see driver I called asked much time take He said take mins reach He telling proper destination inquiring got know mins mins I also got know driver moving opposite direction It around pm We tense train senior citizens despite leaving home early afraid oldies needed rush ignore consequences health catch train Thanks Uber
425,426,Uber horrid work Week week keep issuing fee UberEATS bag I already paid Each week gets taken still yet fix Secondly give incentives make impossible reach I earned additional instead say somehow I meet requirements This company joke
426,427,I confirmed pick Uber The trip driver come pick says place minutes So minutes passed driver never shows I cancel pick Uber I cancel Uber deducted account I cancel pick credited next ride Why I used Uber screwed I think fault fulfill contract place minutes That I cancel trip otherwise I stick
427,428,Well I sign Uber I looking extra income side In beginning started pretty slow I figured things make decent money using Uber Like previous reviews money make really cover expenses like gas car maintenance etc For example total trip fee Uber fee actual earnings gas online hours Which comes minimum wage I put I needed money However recently I pick three passengers I husband drive I feeling well I also vehicle account one three reported Uber husband driver Uber put account hold call investigation complete I received email Uber situation They said since else drove beside I ban I email back said Why I get warning first offense instead complete ban They said zero tolerance account sharing based Uber Driver Their customer service sucks even try call matters I told I seen guidelines beforehand I let husband drive I believe even encourage drivers read entire policies work Either driver rider beware Uber tactics
428,429,I picked customer exactly surge area went miles away So I surge area But Uber gave surge trip I messaged Uber said I surge But I sure Next day I got another request surge place That time I took screenshot shows request comes surge sides surge appears I send information Uber Uber still says surge side asking customer name I save customers name information customers I said like I know trip I sent trip information I They still says customer name trip date whatever They give day I took request I waited mins I called customer said I come I lost keys Please cancel trip I said okay This happens times Because Uber changed driver screen longer I see trips canceled driver So I information I told Uber I cancellation fees They still says Okay give us customer name trip date time fare Hey trip even start customer come I give fare information Also I record customer name whatever If wanted find trip many minutes I waited This totally weird From surge I cancellation fees My total lost I gon na drive Uber They weird And everytime messaged templates help totally
429,430,I took Uber terminal house The bill Later I checked credit card I charged cleaning fee It wife back seat The driver put luggage trunk I emailed Uber immediately send picture back seat full garbage rocks food etc I explained situation I called bank Finally apologized promised complete refund Please take picture car This drivers use kind strategy charge times money Be advised Thanks
430,431,I signed almost month ago I get daily Processing account The site said days Not month I signed Christmas I almost January Why Nobody tell I gotten hold customers services many times Still waiting
431,432,I single mother three month old baby trying get back feet Long story short I got job working I staying Motel taking Uber drop baby go work every day The first day cost go blocks babysitter get work I borrow money next two weeks rides pay back I get paid Well next day get babysitter get work I idea price gouged according demand I enough money rides Thanks lot UBER
432,433,My daughter left new boots Blundestones Uber cab Toronto When got home realized missing luggage She texted driver reply We way country family vacation two weeks contact She went head office Toronto contacted driver He admit finding boots also admitted giving family member lives My daughter told driver suspended boots returned week passed still sign boots How sad drivers responsible lost found approx days yet driver happily gave away belonged Any help suggestions appreciated university money tight
