,Key,ride_review
242,243,Uber mentions standard upfront charges pool rides per promo provided kms I booked cab Saturday pm I showing however per drop location I charged I really know I charged much top Uber driver customer care number I told I giving money shown started giving dhamkis said started talking sternly If pay I able let However I gave money This much unethical wanted say I need refund soon possible I sent innumerable mails Uber tried make calls customer care none worked introduce dynamic charges charge extra amount And I guess even charge person cancels So way Uber making way money They charged times normal charge ride I supposed charged I hope I get positive revert refund soon possible big amount cheating going
243,244,I purchased Uber gift card able get around important places I need get doctor office pharmacy Uber prints gift cards cheap flimsy unreliable paper After purchasing Uber gift card dollars cash credit card unavailable use time I proceeded scratch covering code I able immediately redeem apply account Only I numbers unreadable illegible part gift card paper come There way able read anything beyond disgusting despicable If Uber print gift cards plastic instead paper code stay much intact readable upon Yes may cost little money matters right There way void gift card activated I stuck useless piece paper I paid dollars I panicked begged help store nothing help customer service helpline call help anything All one send messages emails wait hoping resolution problem issue I many many times without success horrible experience Each response I receive simply copied pasted exact words app website course I already know I needed help insensitive robot hours email tag haggling resolution addition calling Uber critical accident safety report line I filing complaint I severely sunburned extreme summer heat unable make clinic pharmacy friend house Uber chosen sacrifice integrity personable immediate assistance squalor quality cheap paper instead durable plastic name profits soured much faith I company My issue still remains outcome I want gift card I paid applied account plus additional extra rider credits applied account pain suffering due way provided business Uber seem immediate resolution issues Of course providing helpline customers call printing gift cards plastic instead paper probably never happen However know I angry
244,245,I waiting long line bus get Greek Theater satellite parking Several people started calling UBER So I Was texted driver way Never shows Then received text unavailable another sent At point I replied Cancel made bus Charges later sent I tried dispute told ride complete I replied someone must taken ride I cancelled They refund
245,246,I use use Uber time past week I purchased car After I got car I received several charges Uber account I immediately informed Uber advised indeed another customer account However done NOTHING try rectify issue They worst communication system possible No one responded two days even refund I also putting review BBB UBER IS A BUNCH OF SCAM ARTISTS AND I NEVER USE THEIR SERVICE AGAIN
246,247,My year old child able independently create account provided services It law supposedly company rules service unaccompanied minors This happened past daughter It scary mom hope company modify registration process ensure clients parental consent waive requirement So sad
247,248,I customer years without one complaint bad review Uber While traveling Mexico I extremely awful experience another customer Uber Share point woman irate offending Uber decided cancel service without even hearing side story I contact numerous times via email attempt I finally received pathetic email stating I longer customer They stated opened investigation yet share information If treat customers I definitely prefer utilize Lyft User beware Uber horrible customer service Do expect even hear side story No wonder plastered negatively news good reason
248,249,My husband I visiting New York City We used Metro buses trip going Carnegie Hall concert rain We want get wet requested Uber first time We waited told sidewalk rain time spare When Uber driver texted see car We tried waving people see one stopped Then drive cancelled driver So waited another least ten minutes another driver ended getting us The next day I emailed charged cancellation fee first ride never took My big problem I contacted Uber understand anything fix I cancel ride standing supposed I wo using Uber
249,250,Totally unprofessional driver First pull location waited across street location So son I walk across NO problem When get destination hotel across street I asked make drop front location He told wanted go straight making He said go around block I said fine I told I going report He sped car middle next block told child get I leave without Uber reported The problem I log Uber account see charge I reach Uber tell clean If see face driver nerve submit pictures water seats I Unacceptable This driver fraud He needs penalized actions I witness account He needs provide time stamp pictures submitted fraud And fact I charged additional I happy services absurd
250,251,On June wife I attended Dave Matthews concert Chicago Afterward directed staff security walk Michigan adjacent campus acquire ride back condo vehicles leaving campus allowed campus roadways We called Uber pm confirmed We standing front condo called address Michigan Ave The Uber confirmation indicated pickup spot Michigan Ave Since opposite Michigan figured pickup address meant We cross street Not easy thing Michigan lanes wide BUSY imagine concert navigated way across street began watch phone driver approached pickup When block away near I tell ap car disappeared ap display I notified ride cancelled Great So called another Uber driver new position across street condo This time driver called tell parked across street WONDERFUL front Michigan We cross Michigan Back originally started That driver delightful When I checked credit card ap view evening charges fee posted I contacted Uber via email informed cancellation fee I cancel Uber DID They paying ME inconvenience They agreed credit Uber account I really appreciate I may never use Uber They maintained company policy prohibited refunding I protested avail told case addition SNAFU ride I summoned Uber pool driver help defray cost trip We made three trip using Uber June We pay full fare trip Apparently riders vicinity evening Not likely There festivals town concert patrons made evening lucrative one drivers There swarm people around Chicago night I told one driver due number drivers called rates increased fares doubled tripled short drives I called I called Uber pool drivers I making quick buck since many people needing rides Uber pools available called It classic Bait Switch operation opinion Travel risk people There reason Uber always news
251,252,I placed order Uber Eats app Less second I placed order I noticed I order subs instead one I wanted remove two subs keep one along stuff I also ordered When I call customer service telling nothing changed canceled order already prepared In less minute placing order calling prepared sub Yeah right So pretty much I forced pay subs I want And Uber app gives option cancel change order call tell ca I see false advertising
252,253,Uber program called Ride Pass rolled lot Philadelphians In exchange fee user receive UberPool rides flat fee UberX rides flat rate within designated area total days The stipulation full value ride exceeds rider must pay overage pool ride costs user charged Easy right I live work within designated area I elated opportunity The trouble started week On Tuesday ride I requested overage I take Uber work rarely goes I checked another account Rider Pass lo behold full fare price I emailed customer service refunded difference two separate occasions admitting system error fixed Yesterday I emailed got overage charges correct Today providing proof full fare ride intentionally inflating UberPool prices Ride Pass customers deleted asked numerous occasions phone number answers always cut paste I really know go It money I mean literally fee overages But principle People know Uber intentionally offering program jacks costs fair I know I access two accounts
253,254,I purchased Uber Smart Pass week ago I noticed several lies within promotion When I first purchased app told anything covered within Smart Pass range Now verbiage changed Also since purchasing Smart Pass Uber drivers canceling rides left right I drivers arrive AT MY APT cancel ride real reason The annoying part charged time I ca comprehend service charges YOU whenever driver cancels That insane Charge drivers inept money hungry better ride Do punished loyal scammed last week ride Brooklyn supposed Smart Pass I received receipt When I contacted Uber gave runaround said merely estimate I told I screenshot ride It estimate They refused refund Uber joke Once Smart Pass expired I deleting app
254,255,I wrote Uber Your previous drunk driver crashes car far away destination still charge He leaves middle nowhere And I pay another Uber far away destination charge ride I kindly ask refund everything scenario killed someone I ca believe still charge refund Uber care whether live die pay fare They employ people drives drunk crashing car middle night turned alive leave side road still charge ride And wait another half hour get another Uber option pay another fare hoping reach alive Uber says partners tend high standards
255,256,times I incorrect fare charged On quoted price I requested ride charged double On I went Locust Ivy Ridge Train station I quoted I Requested ride charged It driver Derrick He Volkswagen Routan He Nice Since happened twice I feel Uber ripping many people The drivers nice friendly
256,257,On June I requested ride business And experience I incredible employee Michelle I get last name waited supervisor got I really appreciated I really recommend business friends family Thank
257,258,Uber mentions standard upfront charges pool rides person pooling cancels ride Uber introduce dynamic charges charge extra amount And guess even charge person cancels So way Uber making way money They charged times normal charge ride another pooler cancelled ride And fooling saying since distance travelled entered originally charging But actually distance increased driver pick another pooler Now person turn So entire money load comes
258,259,Last night I received text Uber stating email address Uber account changed Since I able log account The hacker also changed password Everywhere I look comes back correct email address account I tried contacting Uber resolve problem phone number given email address accept incoming messages The way contact fill contact form website hope call Since references email address according website acknowledged belonging account I know I hear I double authentication account supposed highest form security one get Uber I believe Uber lackadaisy attitude towards riders especially since email address cell phone number travel history credit card information stored account
259,260,I driver Uber noticed I getting shorted pay I sent miles get rider mile ride Made Uber charged rider Uber took gave made real pay Uber cheats drivers On plus rides I given probably cheated thousand dollars customer service JOKE WORSE THAN Comcast
260,261,I delivering Uber Eats client client called Then client called Uber lied said I gun Uber shut said investigating They allow make income Uber days seriously jeopardizes living I taking legal action cut income I done nothing wrong There nothing substantiate decision except client said lie I high evaluations clients taken consideration Drive Lyft Uber
261,262,Horrible All I say I charged cleaning fee Uber incident occur ride This obviously happened another ride driver complete liar I never use
262,263,I arrived train station since I missed bus take mins another one come try request Uber My phone died shuts searching driver I assumed deleted transaction phone completely dead I decided walk home This walk mins train station area sidewalks I make stop store half way home I get home plug phone check email see receipt Uber They charged ride driver reported picked dropped destination happened I walked mins front door I filed complaint response review account believe made trip I expressed I make trip I use time one time I going file complaint They said refund money maybe family used account I expressed I family I stopped store receipt time driver claims dropped It principle matter How report drop someone never got vehicle even know coming I preferred ride home versus walking mins So I got charged ride never happened walk home long day office Uber really need better customer service skills I never use
263,264,I booker Uber go cab Uber application place Bangalore railway station platform Cab came expected time around later driver stopped car asked us get car without cancelling cab We catch train But missed train Uber valid contact number reach I prove trip driver cancelled cab
264,265,I ordered car quickly picked driver Dramane When I arrived destination I tipped Dramane fare I left I immediately noticed cell phone Samsung Galaxy missing I called soon I get valid number UBER NO CUSTOMER SERVICE TO SPEAK WITH AND CALLED The driver answer phone continuous tries Dramane finally picked minutes calling nonstop I asked please look back car phone He told I client ca Bullcrap He done immediately responses I tell acting shady I doubt find phone kept Which means HE STOLE MY CELL PHONE AND UBER DID NOTHING TO HELP ME NO CUSTOMER SERVICE AT ALL
265,266,My Uber account locked Uber claims I outstanding charges account At moment I supposed outstanding balances account Ubereats I say supposed I charged transactions money taken bank account paid I emailing back forth Uber every time always someone different replying though even read previous replies All keep telling charges legitimate The first time told legitimate I relied told I charged I bank statement prove next person tells looks though charges disputed refunded next person tells charges legitimate read previous emails After long time I finally get someone said money refunded April asked send April bank statement I tell looks like system shows refunded May send May statement I reply looks like charges legitimate This really ridiculous one seems able understand I charged never refunded money Btw I never even disputed transactions I know telling disputed I type person likes outstanding balance I always pay bills time Uber treating customers They horrible customer service I still gotten straightened
266,267,I NOT recommend company On top ride charged FOUR TIMES That mile trip And make matters worse birthday ON THE WAY restaurant wife There damage anything charged AND THEY DO HAVE A PHONE NUMBER I email yet respond HOURS since I sent email I NOT recommend company scam Just favor use LYFT I never issue I want money back UBER
267,268,Uber driver Zlata New Orleans charge cleaning fee coffee stains existing car entrance No questions asked driver assumed I made mess charge cleaning fee Uber nothing assist finding correct passenger instead still kept charge
268,269,I many negative encounters Uber even funny They took money account several times trips I take I used use get job always something My last experience I order Uber get job They took money account I saw map driver taking trip without I outside waiting I called driver hang phone I take bus work I late Last least I got warning job hour late There another time took dollars account going NY paying two tolls When I took Uber job I done I deleted app never Lesson learned
269,270,Uber first tried charge incorrect rides I take When I disputed credit card Wells Fargo ONLY removed rides I take Uber stating I pay rides I take I sent proof screen shots wells fargo site even spoke wells times say I pay retracted You call Uber speak someone They keep replying back I pay I even book another ride
270,271,When I used Uber App request ride share ATL airport address economy rideshare quote After I booked ride I received notice I pooling someone else expected fare increased Overcharged fare When I contacted Uber customer support computer generated response stated fare correct refund given When I replied attached supporting screenshots quoted fare actual fare charged I received generic information mention supporting evidence included submitted
271,272,WARNING Take screenshot fare agreeing Uber charge may need change fare later Uber increased agreed fare trip progress When asked denied Disputing said driver may taken efficient route possible Fact take efficient route possible give reason raising already agree fare anyway I trust give another chance need know happens
272,273,Uber record trip I made driver I reached specifics trip I completed basically said I exact records trip prove I made trip provide explanation happened I reach file complaint I signed Uber I thought convenient drive people around free Very disappointed If choose drive Uber sure screenshot document trips money goes missing help
273,274,First complaint Uber REFUSES call anyone conversation dissatisfaction Second complaint running bait switch unethical My TRIP THE ISSUE app told I USE UberX trip Indianapolis airport house Cincinnati fee I checked different time week confirm rate error When I got Indy airport FL I checked app said cost WHEN driver showed tells I ca use UberX select UberXL distance case app alerted FROM THE BEGINNING I use UberXL distance If said THEN I rented car instead pay At time I choice I back Cincinnati Therefore choice follow driver instruction ACCEPT ride UberX short ride I resubmit request UberXL I Instead fare ended AND seems one Uber understand frustration NO ONE willing conversation absolutely ludicrous They know I thought ride cost I logical person rented car lost fare Complete bait switch
274,275,My name Scott husband working Uber He ride people When got metal smoking pipe put hood liner car The pipe left car burn hole car He sent pictures Uber said needed quote So first quote got almost Chrysler since car We received quote phone It far away drive called Chrysler near us They referred us person gave us quote He sent quote Uber got back insurance company called said deductible So amount We sent said paying He contacted Uber messaged back telling tried charge rider rider agree Of course want pay They said insurance company final decision Now I left burn mark Uber rider nothing going done Uber worst company work They even cut pay drivers The pay worth damage Thanks Uber ruining car Lyft way better
275,276,My Uber Account hacked today Uber customer service line contact I unable log account remove payment information due hacker changing email password onto account Uber site says send email someone contact within hours That acceptable I cancel credit cards right Memorial Day Weekend make pleasant holiday Thanks Uber ZERO customer service I want everyone know NO one call happens
276,277,I wondering Uber drivers given ability actually fire clients making families longer use Uber service top rob person There cancellations evening driver hour On night year old son struggled kidney failure since birth whose growth somewhat stunted hanging friend sci fi factory near Keller TX ready walk miles home I told wait I get Uber The Uber driver pulled took one look son screamed ride Then pulled away leaving son standing Never asked ID never even gave call My son informed situation I immediately set ride take home miles road Again ride went driver cancelled well So I reschedule ride son order ride year old miles street The next day Uber account shut gift card attached shortly mom linked thru family Uber program also reported account shut I loved Uber program I written several complaints requesting gift card returned request ignored No one ever asked happened This driver simply concluded son less years I immediately convicted punished error judgement It goal spread word customer service I shown hope happen anyone else
277,278,I noticed reviews Uber low site I felt compelled share positive experiences readers My husband using Uber quite time lot traveling occupation We used Uber together trip San Juan Puerto Rico recently every ride star top notch The drivers friendly professional All vehicles rode smelled fresh clean We actually taxi driver harass one drivers although Uber driver pick us business next door hotel taxi driver tell Uber husband phone hand waved Uber driver I honestly say due taxi driver scaring bullying driver I NEVER take taxi long I live Last I checked live capitalist society competition good us Taxis monopoly I highly recommend Uber
278,279,I started driving Uber referral bonus Figured drive I get dollars friend referred get dollars Fast forward completing drives tell make month week say We mean money bonus top money made We meant guaranteed make dollars giving rides Of course I That incentive Lyft pays dollars moment complete trip I complained stating I want work company bait switch practices instead resolving situation deleted driver app rider app even let cash dollars I made day
279,280,I open account Uber company easy use car service In less month I got check account charged ride Uber I tried many time contact way messages taking long time coming questions nothing solution complaints I called bank closed check account
280,281,I want highlight inconvenience provided company app friend Apoorva account blocked since week trying get touch company via email get reply system raised flag blocked us Lol FLAG updating email address And want us also Appreciate understanding regard LOL We invoices blocked account Hence request someone logical sense look account get sorted Systems errors accepts mistakes days All want invoices make sure never bother Uber ride Ola way better respect quality app Last thing I remember account working updating email address get invoice email mathematically correct systems blocked us updating email Really Great Coding And Super AI Finally person company updated email address I tried log I noticed flag never chance find real account real real anyone Uber read understand trying say please go ahead email us invoices remove wrong flag raised super system Generation download manually Attached image shows suspended Uber ca even share reason Because email team may procedures rules follow blindly I think rules made mentally blind person Uber rocks client shocks
281,282,I use corporate card business trips I use Uber My company told I charge I need show proof I went Uber app seen I never took trip date I reached Uber explained I charged never took ride The first response someone telling send bank statement happy reverse charges I asked job provide proof I get statements corporate sent PDF proof told able make fare adjustments trips completed days ago I explained I informed job I outstanding charge card I known charge sooner I reached Then I get message saying able locate charge send posted date transaction description amount type account I already sent PDF information gave information Then I received another message saying able make fare adjustments trips completed days also asked How I make fraudulent claim I received message closed ticket I responded manager call I received response days I frustrated Uber I reimburse job ride I take Uber ca even locate charged lot money principle Uber done right refunded charge instead sending generic messages Now I use Lyft business trips I want happen
282,283,Uber JFK pools airport passengers going Manhattan Not take airport passenger local passenger going miles adding minutes trip get main route city
283,284,I Uber driver I want comment I try cancel I plenty riders I show destination ready I usually call minutes time way I wait I whose phone goes voice mail I waited minutes come I cancel Uber drivers get paid wait min rider cancels happened pissed especially long trip Riders need outside time call Uber driver I never canceled due destination better yet wants maybe drive I long distance upon arriving rider cancel get paid No excuse
284,285,I recently booked Uber I catch train The driver agreed come I continuously called directed location After mins waiting cancelled I missed train Uber charges cancellation every time time customer suffers driver cancellation Who going refund amount Uber worst experience I continues happen every time I ride
285,286,My family recently visited NYC dad great luck using Uber cities past get cab easily took Uber quite times day trip Some trips great okay one beyond bad We traveling near Times Square Battery Park reservations Ellis Island specific time We selected Battery Park drop point told driver got car dirty smelly car us New York even know Battery Park bottom Manhattan I mean really obscure location We realized getting close reason going tunnel When dad tried ask driver going tunnel really answer question spoke literally English I super glad Uber open hiring cultures everything I think drivers speak enough English communicate passengers route emerged tunnel minutes later turns Brooklyn Now I NYC I know Brooklyn NOT way Battery Park Times Square As tried explain driver clearly wrong place still confused Eventually pull GPS attempt get right place We ended get blocks Battery Park run ferry try make reservations We ended missing time Liberty Island simply driver absolutely idea To add insult injury ferry dad received email fare adjustment tolls tunnel contacted Uber quite messages finally agreed refund half fare half total included completely unnecessary toll charges This driver made completely incomprehensible mistake ruined part vacation honest little scary knew stranger car heading somewhere unknown I think Uber going send completely unprepared irresponsible drivers name need stand behind offer full refunds experiences bad
